{
  "schema_version": "pawl-verdict.v1",
  "bead_id": "age-rk3r.9-rebound-sample",
  "pr": 0,
  "disposition": "REBOUND",
  "generated_at": "2026-07-02T19:07:58Z",
  "author_context_id": "author-ctx",
  "attempt": 1,
  "refuters": [
    {
      "family": "claude",
      "verdict": "CONFIRMED",
      "context_id": "fresh-ctx",
      "evidence": ".agents/pawl-review/age-rk3r.9-rebound-sample-pawl-review.txt"
    }
  ],
  "head_sha": "3fb96d7908a9cf81cd51acb9a2b1c1991f8a7449",
  "rebound_from_verdict": ".agents/pawl-verdicts/age-rk3r.9-rebound-sample.confirmed-20fbb56d0c69.json",
  "rebound_from_sha": "20fbb56d0c6954bfdd809598cf1619a27f0badfb",
  "patch_id_proof": "673e1ec6b3b03c9b4e7b5ebec2331a936fc45419"
}
